{"cutoff_at":"2026-10-24T12:00:00Z","manifest_sha256":"ce082cda3546d71f6e0b1da12cb3f55a80edfc7d02b16af3cd46dfb2053a6cc7","run_id":"7468a9a8-8e10-56be-9f5e-f03cb0fb94b1","schema_version":"1.0","status":"sealed","storage_commit":"ae577d959685b5a6c9c19d4f28e4fc197bcae0a5","target_date_wita":"2026-10-25"}
