{"cutoff_at":"2026-10-31T12:00:00Z","manifest_sha256":"03ec38ab6220f5fe357a2e7e53f0243a27f0c311270b52b27b7c0eb4b5d2adb3","run_id":"925c1f21-3902-52bb-8b44-5e928e1c8ecd","schema_version":"1.0","status":"sealed","storage_commit":"6650f68c7cc10c1f6b997bf9a8b209b2a0a1dfff","target_date_wita":"2026-11-01"}
