{"cutoff_at":"2026-10-26T12:00:00Z","manifest_sha256":"df27459043144308aba2f8a7afe5261596627705269a8d37f5e26922b495a694","run_id":"90c93194-0e8e-5023-bf66-707649027891","schema_version":"1.0","status":"sealed","storage_commit":"6c38074b85aada2d896cdc60192559fb8c360e27","target_date_wita":"2026-10-27"}
