{"cutoff_at":"2026-10-14T12:00:00Z","manifest_sha256":"bc0c056b5528df4913761ba472a716cf2c0cb063791fee6d1c1e531895a941cd","run_id":"170b674d-8985-5a4d-b962-69455dfc5b89","schema_version":"1.0","status":"sealed","storage_commit":"bea9187f5d309cd350040a31d203305228bd31c2","target_date_wita":"2026-10-15"}
