{"cutoff_at":"2026-10-10T12:00:00Z","manifest_sha256":"097a01358d29c40466fe21c70c4adc72a0179e999cca6006877cc86dbeeb07e8","run_id":"0f7db7a3-f7d6-57bc-b82f-0f780bbd5ccf","schema_version":"1.0","status":"sealed","storage_commit":"6366e094bde5a3c2433d481e37febf3c132c9206","target_date_wita":"2026-10-11"}
