{"cutoff_at":"2026-10-09T12:00:00Z","manifest_sha256":"120e515a7d0badfbe37d79c0fce3530018e70f61626fcebb84e5df9dcd0ff877","run_id":"fbedf52a-1daa-5d3a-ac1f-0b66a56da61b","schema_version":"1.0","status":"sealed","storage_commit":"7a29861175eafaeb5675a3d13a468f6fa86ec348","target_date_wita":"2026-10-10"}
