{"cutoff_at":"2026-10-08T12:00:00Z","manifest_sha256":"069976a243e8f2d74f12ee16a4b778865d6fbd2c9506ab70106799de4c1f06e2","run_id":"12ab5b5b-e1f0-59cc-88af-811903b2c95a","schema_version":"1.0","status":"sealed","storage_commit":"681c6c2647c6797847fed5f217847034bd7baebc","target_date_wita":"2026-10-09"}
