{"cutoff_at":"2026-10-18T12:00:00Z","manifest_sha256":"2bdc7ba882f290b4cb58bbd06f58363f7b01aed8467ea2ae3d72f92bed968398","run_id":"9f142c2e-f920-5c06-9388-298de02a83bd","schema_version":"1.0","status":"sealed","storage_commit":"4638162e94c470e9cf19a79ff8a92f8308157faf","target_date_wita":"2026-10-19"}
