{"cutoff_at":"2026-10-17T12:00:00Z","manifest_sha256":"77b404f59666c46af053eee0d4cf1bed1415cb4a124105051ed683bae11d0bad","run_id":"14f779fc-b8ce-5c4d-a517-f5f8561462a0","schema_version":"1.0","status":"sealed","storage_commit":"452d0316623a47c8c0638eb2fe1dda8eb470ed12","target_date_wita":"2026-10-18"}
