{"cutoff_at":"2026-10-25T12:00:00Z","manifest_sha256":"7016604e890ee9a73d13ae8c56e9ebe07519f0943dd048a8fdfb023082403f3f","run_id":"0248d49a-2ffd-55fe-8a1f-25f9e8cd7b9b","schema_version":"1.0","status":"sealed","storage_commit":"1b361466ea1329c4ed5f8395a4437e7dd1bb2aba","target_date_wita":"2026-10-26"}
