{"cutoff_at":"2026-10-20T12:00:00Z","manifest_sha256":"3812aed95a398fbfc0168c801c1606590eeea0c2ca6e17d21aa64ce64651b69d","run_id":"a5ff1d84-c95b-5bab-a0bb-2599bde05faf","schema_version":"1.0","status":"sealed","storage_commit":"b27deeb2ad80ba2a44f7f9531ff4960b06d1a8bf","target_date_wita":"2026-10-21"}
