{"cutoff_at":"2026-10-19T12:00:00Z","manifest_sha256":"82a190d40a0d5994f2051fa42aa4a89706a880ae1da47175692d6f31e01a5e2d","run_id":"3481fac1-fd3d-551b-af18-2ee8540c8847","schema_version":"1.0","status":"sealed","storage_commit":"5d1a7abbf689127d4f85132ed54fcd4e9c4e8f8e","target_date_wita":"2026-10-20"}
