{"cutoff_at":"2026-10-07T12:00:00Z","manifest_sha256":"7df692548ff28751d4143286310d543373a6f8037b82e9dfca34c3c8bfe336e8","run_id":"a1e67d63-8470-56d4-8642-ac054663c69b","schema_version":"1.0","status":"sealed","storage_commit":"74f3d864636adeca0d317f0502deb623421a2dd8","target_date_wita":"2026-10-08"}
